TV_id,title,cast,country,release_year,listed_in,description,URL
1475,Trolls: The Beat Goes On!,"Amanda Leighton, Skylar Astin, Ron Funches, David Fynn, David Koechner, David Kaye, Sean T. Krishnan, Sam Lerner, Patrick Pinney, Kevin Michael Richardson, Kari Wahlgren, Fryda Wolff",United States,2019,"Kids' TV, TV Comedies","As Queen Poppy welcomes a new time of peace in Troll Village with parties, sports and holiday celebrations, Branch tries to be more fun-loving.",
1476,Mystery Science Theater 3000: The Return,"Felicia Day, Patton Oswalt, Jonah Ray, Baron Vaughn, Hampton Yount",United States,2018,"TV Comedies, TV Sci-Fi & Fantasy","The cult hit returns! Captured by mad scientists, new host Jonah survives a blitz of cheesy B movies by riffing on them with his funny robot pals.",https://artworks.thetvdb.com/banners/posters/254854-2.jpg
1477,Lilyhammer,"Steven Van Zandt, Trond Fausa, Steinar Sagen, Robert Skjærstad, Tommy Karlsen, Fridtjov Såheim, Marian Saastad Ottesen","Norway, United States",2014,"Crime TV Shows, TV Comedies, TV Dramas","After testifying against the Mafia, ex-gangster Frank Tagliano enters witness protection and asks to be sent to Norway.",https://artworks.thetvdb.com/banners/posters/152721-6.jpg
1478,Victorious,"Victoria Justice, Leon Thomas III, Matt Bennett, Elizabeth Gillies, Ariana Grande, Avan Jogia, Daniella Monet, Michael Eric Reid, Jake Farrow, Eric Lange",United States,2013,"Kids' TV, TV Comedies","When aspiring singer Tori Vega joins the eccentric students at Hollywood Arts High, she struggles to fit in with the amazingly talented teens.",https://artworks.thetvdb.com/banners/posters/79861-3.jpg
1479,House of Cards,"Kevin Spacey, Robin Wright, Kate Mara, Corey Stoll, Sakina Jaffrey, Kristen Connolly, Constance Zimmer, Sebastian Arcelus, Nathan Darrow, Sandrine Holt, Michel Gill, Elizabeth Norment, Mahershala Ali, Reg E. Cathey, Molly Parker, Derek Cecil, Elizabeth Marvel, Kim Dickens, Lars Mikkelsen, Michael Kelly, Joel Kinnaman, Campbell Scott, Patricia Clarkson, Neve Campbell",United States,2018,"TV Dramas, TV Thrillers","A ruthless politician will stop at nothing to conquer Washington, D.C., in this Emmy and Golden Globe-winning political drama.",https://artworks.thetvdb.com/banners/posters/298566-2.jpg
1480,The Last Kingdom,"Alexander Dreymon, Emily Cox, David Dawson, Ian Hart, Rune Temte, Matthew Macfadyen, Rutger Hauer, Tobias Santelmann, Peter Gantzler, Adrian Bower, Joseph Millson, Henning Valin Jakobsen, Alexandre Willaume, Thomas W. Gabrielsson",United Kingdom,2018,"British TV Shows, International TV Shows, TV Action & Adventure","As Alfred the Great defends his kingdom from Norse invaders, Uhtred – born a Saxon but raised by Vikings – seeks to claim his ancestral birthright.",https://artworks.thetvdb.com/banners/posters/78790-4.jpg
1481,Goosebumps,R.L. Stine,Canada,1998,"Kids' TV, TV Thrillers",R.L. Stine's tales take on a life of their own in a series that combines original stories with adaptations drawn from the popular books.,https://artworks.thetvdb.com/banners/posters/71416-5.jpg
1482,The Magic School Bus,"Lily Tomlin, Daniel DeSanto, Erica Luttrell, Maia Filar, Lisa Yamanaka, Tara Meyer, Stuart Stone, Malcolm-Jamal Warner, Danny Tamberelli","Canada, United States",1997,Kids' TV,"Join Ms. Frizzle as the Magic School Bus travels to outer space, under the sea, through an anthill – and even inside the human body!",https://artworks.thetvdb.com/banners/posters/305574-3.jpg
1483,The Crown,"Claire Foy, John Lithgow, Matt Smith, Vanessa Kirby, Jared Harris, Victoria Hamilton, Eileen Atkins, Jeremy Northam, Alex Jennings, Ben Miles, Pip Torrens, Will Keen, Harry Hadden-Paton, Daniel Ings, Greg Wise, Harriet Walter, Lia Williams, Matthew Goode, Anton Lesser","United Kingdom, United States",2019,"British TV Shows, International TV Shows, TV Dramas",This drama follows the political rivalries and romance of Queen Elizabeth II's reign and the events that shaped the second half of the 20th century.,https://artworks.thetvdb.com/banners/posters/253491-2.jpg
1484,Longmire,"Robert Taylor, Katee Sackhoff, Lou Diamond Phillips, Bailey Chase, Cassidy Freeman, Adam Bartley, Louanne Stephens",United States,2017,"Crime TV Shows, TV Dramas",This contemporary crime thriller focuses on a Wyoming sheriff who's rebuilding his life and career following the death of his wife.,https://artworks.thetvdb.com/banners/posters/322693-1.jpg
1485,Luna Petunia,"Ciara Alexys, Katie Griffin, Cory Doran, Jonah Wineberg",United States,2017,Kids' TV,"With help from her magic toy chest, fun-loving Luna Petunia enters the fantastic land of Amazia, where adventures, friendship and learning await.",https://artworks.thetvdb.com/banners/posters/5b6203a856604.jpg
1486,Ponysitters Club,"Morgan Neundorf, Madeline Leon, Khiyla Aynne, Cailan Laine Punnewaert, Zyon Allen, Maya Franzoi, Victoria Tomazelli, Hugh Wilson, Diana Chrisman",Canada,2018,"Kids' TV, TV Dramas",A young horse enthusiast teams up with her best friends to rescue and rehabilitate animals on her family's beloved ranch.,https://artworks.thetvdb.com/banners/posters/87501-1.jpg
1487,K-On!,"Aki Toyosaki, Ayana Taketatsu, Chika Fujito, Madoka Yonezawa, Minako Kotobuki, Satomi Sato, Yoko Hikasa",Japan,2010,"Anime Series, Teen TV Shows","When they're not gorging themselves on sugary snacks, four aspiring high school musicians crank out catchy tunes as members of the Light Music Club.",https://artworks.thetvdb.com/banners/posters/5bc4dd9c12c9c.jpg
1488,Llama Llama,"Jennifer Garner, Shayle Simons, Vania Gill, Islie Hirvonen, Brendon Sunderland, Austin Abell, Evans Johnson, Kathleen Barr, David Hoole",United States,2019,Kids' TV,"Beloved children's book character Llama Llama springs to life in this heartwarming series about family, friendship and learning new things.",https://artworks.thetvdb.com/banners/posters/339312-2.jpg
1489,The Toys That Made Us,,United States,2019,"Docuseries, Reality TV",The minds behind history's most iconic toy franchises discuss the rise – and sometimes fall – of their billion-dollar creations.,https://artworks.thetvdb.com/banners/posters/310578-2.jpg
1490,The Yard,"Demet Evgar, Ceren Moray, Nursel Köse, Kenan Ece, Teoman Kumbaracıbaşı, Çağdaş Onur Öztürk, Deniz Barut, Onuryay Evrentan, Görkem Mertsöz, Mert Tanık, Ayça Damgacı",Turkey,2019,"Crime TV Shows, International TV Shows, TV Dramas","After a fateful domestic clash, a devoted mother finds herself in prison and fighting to survive in hopes of reuniting with her daughter.",https://artworks.thetvdb.com/banners/posters/5d07254abef06.jpg
1491,Chief of Staff,"Lee Jung-jae, Shin Mina, Lee Elijah, Kim Dong-jun, Jung Jin-young, Kim Kap-soo, Jung Woong-in, Im Won-hee, Kim Hong-pa",South Korea,2019,"International TV Shows, Korean TV Shows, TV Dramas","As a chief of staff in the National Assembly, Jang Tae-jun influences power behind the scenes while pursuing his own ambitions to rise to the top.",https://artworks.thetvdb.com/banners/posters/212171-5.jpg
1492,My Little Pony: Friendship Is Magic,"Ashleigh Ball, Tabitha St. Germain, Tara Strong, Andrea Libman, Cathy Weseluck, Nicole Oliver","United States, Canada",2018,Kids' TV,"Journey to the enchanted land of Equestria, where unicorn Twilight Sparkle and her pals have adventures and learn valuable lessons about friendship.",https://artworks.thetvdb.com/banners/posters/5bab9aa957840.jpg
1493,Patriot Act with Hasan Minhaj,Hasan Minhaj,,2019,TV Comedies,"Every Sunday, Hasan Minhaj brings an incisive and nuanced perspective to global news, politics and culture in his unique comedy series.",https://artworks.thetvdb.com/banners/posters/5b2c4c495eb3c.jpg
1494,Glitter Force Doki Doki,"Debi Derryberry, Cassandra Morris, Melissa Fahn, Stephanie Sheh, Erica Lindbeck, Kate Higgins, Cherami Leigh, Tara Sands, Bryce Papenbrook, Erica Mendez, Ray Chase, Carrie Keranen, Ben Diskin, Grant George, Kirk Thornton",Japan,2017,"Anime Series, Kids' TV",Four girls summon their inner superheroes to defend Earth and the magical kingdom of Splendorius from King Mercenare and his minions.,https://artworks.thetvdb.com/banners/posters/308563-3.jpg
1495,Lady Dynamite,"Maria Bamford, Fred Melamed, Mary Kay Place, Ed Begley Jr., Ana Gasteyer, Lennon Parham, Bridget Everett, Mo Collins, June Diane Raphael, Dean Cain, Ólafur Darri Ólafsson, Patton Oswalt, Keith Lucas, Kenny Lucas, Sarah Silverman, Mira Sorvino, Jon Cryer, Brandon Routh, Adam Pally, Tig Notaro, Andy Samberg, David Spade, Fred Armisen, Jason Mantzoukas, Jenny Slate, Judd Apatow, Judy Greer, Weird Al Yankovic",United States,2017,TV Comedies,Comedian Maria Bamford stars in a series inspired by her own life. It's the sometimes surreal story of a woman who loses – and then finds – her s**t.,https://artworks.thetvdb.com/banners/posters/330374-2.jpg
1496,Atypical,"Jennifer Jason Leigh, Keir Gilchrist, Michael Rapaport, Brigette Lundy-Paine, Amy Okuda, Jenna Boyd, Graham Rogers, Nik Dodani",United States,2019,"TV Comedies, TV Dramas, Teen TV Shows","When a teen on the autism spectrum decides to get a girlfriend, his bid for more independence puts his whole family on a path of self-discovery.",https://artworks.thetvdb.com/banners/posters/254540-4.jpg
1497,Billy on the Street,Billy Eichner,United States,2016,"International TV Shows, Reality TV, TV Comedies","Comedian Billy Eichner sprints through New York with celebrities to stun pedestrians with unapologetic, unfiltered and unique pop culture questions.",https://artworks.thetvdb.com/banners/series/81967/posters/62113935.jpg
1498,Bondi Rescue,"Andrew Günsberg, Dean Gladstone, Bruce Hopkins, Trent 'Maxi' Maxwell, Andrew Reid, Ryan Clark, Chris Chapman, Anthony 'Harries' Caroll",Australia,2016,Reality TV,"This reality series follows elite professional lifeguards on Sydney's Bondi Beach, as they take on everything from animal stings to criminals.",https://artworks.thetvdb.com/banners/posters/80644-6.jpg
1499,CLANNAD,"Yuichi Nakamura, David Matranga, Mai Nakahara, Luci Christian, Ryo Hirohashi, Shelley Calene-Black, Ai Nonaka, Hilary Haag, Akemi Kanda, Brittney Karbowski, Houko Kuwashima, Kaytha Coker, Mamiko Noto, Emily Neves, Daisuke Sakaguchi, Greg Ayres",Japan,2008,"Anime Series, Teen TV Shows",Maladjusted high school student Tomoya's life begins to change when he befriends his classmate Nagisa and several other eccentric girls.,https://artworks.thetvdb.com/banners/posters/278157-1.jpg
1500,Haikyu!!,"Ayumu Murase, Kaito Ishikawa, Satoshi Hino, Miyu Irino, Yu Hayashi, Koki Uchiyama, Soma Saito, Nobuhiko Okamoto, Yoshimasa Hosoya, Toshiki Masuda, Kaori Nazuka, Hiroshi Kamiya, Kazunari Tanaka, Daisuke Namikawa, Hiroyuki Yoshino, Sumire Morohoshi, Yuichi Nakamura, Yuki Kaji, Shinnosuke Tachibana, Mark Ishii, Ryohei Kimura, Ryota Takeuchi, Hisao Egawa, Subaru Kimura",Japan,2015,"Anime Series, International TV Shows, Teen TV Shows","Inspired by a championship match he sees on TV, junior high schooler Hinata joins a volleyball club and begins training, despite his short height.",https://artworks.thetvdb.com/banners/posters/278157-1.jpg
1501,"Love, Chunibyo & Other Delusions!","Jun Fukuyama, Maaya Uchida, Chinatsu Akasaki, Azumi Asakura, Sumire Uesaka, Yuri Amano, Kaori Fukuhara, Mami Shitara, Soichiro Hoshi, Kikuko Inoue, Eri Sendai, Juri Nagatsuma",Japan,2014,"Anime Series, Romantic TV Shows, Teen TV Shows","High schooler Yuta wants to leave his past as a delusional weirdo behind. But his classmate Rikka has her own delusions, and she's interested in his.",https://artworks.thetvdb.com/banners/posters/261862-3.jpg
1502,Mars,"Jihae, Alberto Ammann, Clémentine Poidatz, Anamaria Marinca, Sammi Rotibi, Nicholas Wittman, Cosima Shaw",United States,2018,"Docuseries, Science & Nature TV, TV Dramas",Fact meets fiction in this docudrama chronicling the journey of a spacecraft crew as it embarks in 2033 on a mission to colonize the red planet.,https://artworks.thetvdb.com/banners/posters/316345-3.jpg
1503,Mobile Suit Gundam: Iron-Blooded Orphans,"Kengo Kawanishi, Yoshimasa Hosoya, Natsuki Hanae, Yuuichirou Umehara, Yasuaki Takumi, Taishi Murata, Kouhei Amasaki, Mutsumi Tamura, Soma Saito, Yuka Terasaki, Hisako Kanemoto, Takahiro Sakurai, Masaya Matsukaze, Toru Okawa",,2016,"Anime Series, International TV Shows","On a terraformed post-disaster Mars, a group of child security agents rebel against the adults who betrayed them and the oppressive Earth government.",https://artworks.thetvdb.com/banners/posters/299497-2.jpg
1504,The Boulet Brothers Dragula,Boulet Brothers,United States,2019,Reality TV,"Ten queens must slay the competition and put their fiercest, filthiest faces forward for the chance to be crowned the world's next drag supermonster.",https://artworks.thetvdb.com/banners/posters/323152-2.jpg
1505,The Deep,"Vincent Tong, Ashleigh Ball, Kathleen Barr, Michael Dobson, Brian Drummond","Canada, Australia",2019,Kids' TV,"The Nektons are a family of underwater explorers who discover the hidden secrets of the oceans, including sunken cities, sea creatures and pirates.",https://artworks.thetvdb.com/banners/series/304075/posters/62066905.jpg
1506,Creators,"Fabio Aste, Héctor Segura, Sebastian Rosas",Argentina,2015,"Kids' TV, Spanish-Language TV Shows","Two brilliant scientists discover the hidden virtual city of Creápolis, where citizens have the power to solve problems by believing and creating.",na
1507,Follow This,"John Stanton, Scaachi Koul, Azeen Ghorayshi, Bim Adewunmi, Juliane Loffler, Charlie Warzel",United States,2018,Docuseries,Follow the reporters at BuzzFeed as they probe topics ranging from quirky internet crazes to safe injection spaces for opioid users.,https://artworks.thetvdb.com/banners/posters/5cac6162e9eb3.jpg
1508,Grand Hotel,"Yon González, Amaia Salamanca, Adriana Ozores, Pedro Alonso, Concha Velasco, Llorenç González, Pep Anton Muñoz, Eloy Azorín, Fele Martínez, Luz Valdenebro, Marta Larralde, Antonio Reyes, Iván Morales, Dion Córdoba, Raquel Sierra",Spain,2013,"International TV Shows, Romantic TV Shows, Spanish-Language TV Shows","To learn the truth about his sister's mysterious disappearance, a young man infiltrates a hotel in the guise of a footman and begins an investigation.",https://artworks.thetvdb.com/banners/posters/5ce6a5204e60d.jpg
1509,That '70s Show,"Topher Grace, Mila Kunis, Ashton Kutcher, Danny Masterson, Laura Prepon, Wilmer Valderrama, Debra Jo Rupp, Kurtwood Smith, Don Stark, Tanya Roberts, Tommy Chong, Lisa Robin Kelly",United States,2005,TV Comedies,"Feel groovy in 1970s suburbia, where a teen and his pals hang in the basement, listening to rock and indulging other hazy benefits of '70s culture.",https://artworks.thetvdb.com/banners/posters/73787-10.jpg
1510,The Mind of a Chef,"Anthony Bourdain, David Chang, Sean Brock, April Bloomfield, Edward Lee, Magnus Nilsson, Gabrielle Hamilton, David Kinch, Ludo Lefebvre",United States,2016,Docuseries,Producer and narrator Anthony Bourdain explores the creative processes of international celebrity chefs to learn what fuels their culinary artistry.,https://artworks.thetvdb.com/banners/posters/263160-1.jpg
1511,Top Boy,"Ashley Walters, Kane Robinson, Malcolm Kamulete, Shone Romulus, Sharon Duncan Brewster, Giacomo Mancini, Xavien Russell, Kierston Wareing, Geoff Bell, Nicholas Pinnock",United Kingdom,2011,"British TV Shows, Crime TV Shows, International TV Shows","In this gritty, stylish drama series, two London drug dealers ply their lucrative trade at a public housing estate in North London.",https://artworks.thetvdb.com/banners/posters/253138-1.jpg
1512,Highway to Heaven,"Michael Landon, Victor French",United States,1988,TV Dramas,"Under God's direction, angel Jonathan and ex-cop Mark help troubled souls overcome adversity and embrace honesty, kindness and forgiveness.",https://artworks.thetvdb.com/banners/posters/76862-6.jpg
1513,Women Behind Bars,,United States,2010,"Crime TV Shows, Docuseries","This reality series recounts true stories of women who have been convicted for murder, including an in-depth examination of each crime.",https://artworks.thetvdb.com/banners/posters/268852-1.jpg
1514,Lucifer,"Tom Ellis, Lauren German, Kevin Alejandro, D.B. Woodside, Lesley-Ann Brandt, Scarlett Estevez, Rachael Harris, Aimee Garcia, Tricia Helfer, Tom Welling, Jeremiah W. Birkett, Pej Vahdat, Michael Gladis",United States,2019,"Crime TV Shows, TV Comedies, TV Dramas","Bored with being the Lord of Hell, the devil relocates to Los Angeles, where he opens a nightclub and forms a connection with a homicide detective.",https://artworks.thetvdb.com/banners/posters/295685-9.jpg
1515,Queen of the South,"Alice Braga, Veronica Falcón, Justina Machado, Peter Gadiot, Hemky Madera, Gerardo Taracena","United States, Mexico, Spain, Malta",2018,"Crime TV Shows, TV Action & Adventure, TV Dramas","Forced to work for a cartel that recently killed her boyfriend, Teresa relies on her street smarts, a loyal pal and a mysterious notebook to survive.",https://artworks.thetvdb.com/banners/posters/306719-1.jpg
1516,Prince Jai Aur Dumdaar Viru,,,2017,"Kids' TV, TV Comedies","A prince and a commoner who are best friends keep having to thwart the plots of the prince's scheming, ambitious minister.",na
1517,Kazoops!,"Reece Pockney, Scott Langley, Alex Babic, Gemma Harvey, Jessica Hann, Emma Tate",Australia,2017,Kids' TV,Music meets imagination in this inventive animated series about thinking outside the box and having fun.,https://artworks.thetvdb.com/banners/posters/313085-1.jpg
1518,Kong: King of the Apes,"Lee Tockar, Sam Vincent, Alessandro Juliani, Tabitha St. Germain, Kathleen Barr, Viv Leacock, Shannon Chan-Kent, Vincent Tong","United States, Japan, Canada",2018,Kids' TV,"In 2050, an evil scientist is about to unleash an army of robotic dinosaurs. Now it's up to Kong and friends to fight back and save the day.",https://artworks.thetvdb.com/banners/posters/306857-2.jpg
1519,Bad Blood,"Anthony LaPaglia, Kim Coates, Enrico Colantoni, Paul Sorvino, Maxim Roy, Brett Donahue, Michelle Mylett, Claudia Ferri, Tony Nappo",Canada,2019,"Crime TV Shows, TV Dramas","This sprawling crime drama follows the true story of the Rizzuto family and its associates, who presided over organized crime in Montreal for decades.",https://artworks.thetvdb.com/banners/posters/333805-2.jpg
1520,My Next Guest Needs No Introduction With David Letterman,"President Barack Obama, George Clooney, Malala Yousafzai, Jay-Z, Tina Fey, Howard Stern, David Letterman",United States,2019,Stand-Up Comedy & Talk Shows,TV legend David Letterman teams up with fascinating global figures for in-depth interviews and curiosity-fueled excursions in this monthly talk show.,https://artworks.thetvdb.com/banners/posters/340520-1.jpg
1521,Oh No! It's an Alien Invasion,"Al Mukadam, Dan Chameroy, Seán Cullen, Stacey DePass, Barbara Mamabolo, Robert Tinkler, Ryan Cooley, Brianna Daguanno",Canada,2014,"Kids' TV, TV Action & Adventure, TV Sci-Fi & Fantasy",Nate and his Super Wicked Extreme Emergency Team –  S.W.E.E.T. – take on alien invaders who have captured all the world's grownups.,https://artworks.thetvdb.com/banners/posters/299710-1.jpg
1522,Unbreakable Kimmy Schmidt,"Ellie Kemper, Jane Krakowski, Tituss Burgess, Carol Kane",United States,2019,TV Comedies,"When a woman is rescued from a doomsday cult and lands in New York City, she must navigate a world she didn’t think even existed anymore.",https://artworks.thetvdb.com/banners/posters/281593-2.jpg
1523,American Crime,"Felicity Huffman, Timothy Hutton, Elvis Nolasco, Regina King, Lili Taylor, Richard Cabral, Brent Anderson, Benito Martinez, Shane Jacobsen, W. Earl Brown, Caitlin Gerard, Penelope Ann Miller, Johnny Ortiz",United States,2017,"Crime TV Shows, TV Dramas","This anthology series unfolds a different story arc for each season, with dramas focusing on aspects of American life and the criminal justice system.",https://artworks.thetvdb.com/banners/posters/289108-8.jpg
1524,Cupcake & Dino - General Services,"Justin Collette, Mark Little, Kyle Dooley, Mark Forward, Joris Jarksy, Julie Lemieux, Kayla Lorette, Julie Sype","Canada, Brazil",2019,"Kids' TV, TV Comedies",An enterprising cupcake and his cheerful dinosaur brother take on jobs of all sorts as they work to help friends and strangers in their eccentric city.,https://artworks.thetvdb.com/banners/posters/5b7f46234dd86.jpg
1525,Supernatural,"Jared Padalecki, Jensen Ackles, Mark Sheppard, Misha Collins, Jim Beaver, Andrea Menard, Samantha Smith, Mark Pellegrino, Alexander Calvert",United States,2019,"Classic & Cult TV, TV Action & Adventure, TV Horror","Siblings Dean and Sam crisscross the country, investigating paranormal activity and picking fights with demons, ghosts and monsters.",https://artworks.thetvdb.com/banners/posters/78901-35.jpg
1526,Total Drama,"Clé Bennett, Christian Potenza, Scott McCord, Rachel Wilson, Drew Nelson, Stephanie Anne Mills, Novie Edwards, Megan Fahlenbock, Brian Foud, Emilie-Claire Barlow, Phillip David Lewis, Katie Crown, Sarah Gadon, Peter Oldring, Kristin Fairlie, Dan Petronijevic, Adam Greydon Reid","Canada, United States, France",2015,"Kids' TV, TV Comedies","Heartwarming moments are interspersed with backstabbing, scheming, sabotage and broken alliances in this animated spoof of reality show competitions.",https://artworks.thetvdb.com/banners/posters/83294-1.jpg
1527,Arrested Development,"Jason Bateman, Portia de Rossi, Will Arnett, Michael Cera, Alia Shawkat, Tony Hale, David Cross, Jeffrey Tambor, Jessica Walter, Ron Howard",United States,2019,TV Comedies,"It's the Emmy-winning story of a wealthy family that lost everything, and the one son who had no choice but to keep them all together.",https://artworks.thetvdb.com/banners/posters/72173-8.jpg
1528,DC's Legends of Tomorrow,"Victor Garber, Brandon Routh, Caity Lotz, Franz Drameh, Amy Pemberton, Dominic Purcell, Maisie Richardson-Sellers, Nick Zano, Arthur Darvill, Wentworth Miller, Tala Ashe, Adam Tsekhman, Christina Brucato, Simon Merrells, Nils Hognestad, Jes Macallan, Keiynan Lonsdale",United States,2018,"TV Action & Adventure, TV Sci-Fi & Fantasy","A mysterious ""time master"" from the future unites an unlikely group of superheroes and villains to save the world from a powerful evil.",https://artworks.thetvdb.com/banners/posters/295760-2.jpg
1529,Hell on Wheels,"Anson Mount, Colm Meaney, Common, Dominique McElligott, Eddie Spears, Ben Esler, Phil Burke, Christopher Heyerdahl, Robin McLeavy, Tom Noonan","Canada, United Kingdom",2016,"Crime TV Shows, TV Action & Adventure",Former Confederate soldier Cullen Bohannon sets out on a quest to find his wife's killer as post-Civil War America struggles to rebuild its identity.,https://artworks.thetvdb.com/banners/posters/212961-4.jpg
1530,Supergirl,"Melissa Benoist, Mehcad Brooks, Chyler Leigh, Jeremy Jordan, David Harewood, Calista Flockhart, Emma Tremblay, Adrian Pasdar, Katie McGrath, David St. Louis, Odette Annable, Floriana Lima, Erica Durance",United States,2019,"TV Action & Adventure, TV Sci-Fi & Fantasy","To avert a disaster, Kara Danvers reveals her powers and true identity: She is Superman's cousin, now known as Supergirl, protector of National City.",https://artworks.thetvdb.com/banners/posters/295759-7.jpg
1531,Mako Mermaids: An H2O Adventure,"Lucy Fry, Ivy Latimer, Amy Ruffle, Chai Romruen, Isabel Durant, Allie Bertram, Linda Ngo, Gemma Forsyth, Dominic Deutscher, Kerith Atkinson, Rowan Hills, Brooke Nichole Lee",Australia,2016,"Kids' TV, TV Comedies","This ""H2O"" sequel follows Zac, a boy who accidentally turns into a merman and threatens the existence of three young mermaids who guard Mako Island.",https://artworks.thetvdb.com/banners/posters/269909-6.jpg
1532,Bloodline,"Kyle Chandler, Ben Mendelsohn, Sissy Spacek, Linda Cardellini, Norbert Leo Butz, Jacinda Barrett, Jamie McShane, John Leguizamo, Enrique Murciano, Sam Shepard, Chloë Sevigny, Andrea Riseborough, Beau Bridges, Taylor Rouviere, Owen Teague, Brandon Larracuente",United States,2017,"TV Dramas, TV Mysteries, TV Thrillers","When the black sheep son of a respected family threatens to expose dark secrets from their past, sibling loyalties are put to the test.",https://artworks.thetvdb.com/banners/posters/287314-3.jpg
1533,Bitten,"Laura Vandervoort, Greyston Holt, Greg Bryk, Steve Lund, Paul Greene, Michael Xavier, Genelle Williams",Canada,2016,"International TV Shows, TV Dramas, TV Horror","Elena Michaels tries to stray from the pack of werewolves that turned her into a monster, but her efforts are thwarted by a string of grisly murders.",https://artworks.thetvdb.com/banners/posters/269550-4.jpg
1534,Trollhunters,"Kelsey Grammer, Anton Yelchin, Charlie Saxton, Lexi Medrano, Fred Tatasciore, Clancy Brown, Mark Hamill, Ron Perlman, Steven Yeun, Amy Landecker, Jonathan Hyde, Anjelica Huston, Lena Headey, David Bradley, Tom Kenny, Laraine Newman, Grey Griffin, James Purefoy","United States, Mexico",2018,"Kids' TV, TV Action & Adventure, TV Sci-Fi & Fantasy","After uncovering a mysterious amulet, an average teen assumes an unlikely destiny and sets out to save two worlds. Created by Guillermo del Toro.",https://artworks.thetvdb.com/banners/posters/318201-2.jpg
1535,She's Gotta Have It,"DeWanda Wise, Cleo Anthony, Lyriq Bent, Anthony Ramos, Chyna Layne, Margot Bingham, Ilfanesh Hadera, Elvis Nolasco, De'Adre Aziza",United States,2018,"Romantic TV Shows, TV Comedies, TV Dramas",Nola Darling struggles to stay true to herself and her dreams while juggling three lovers in this Spike Lee series based on his breakout film.,https://artworks.thetvdb.com/banners/series/330717/posters/5ea7306584b38.jpg
