TV_id,title,cast,country,release_year,listed_in,description,URL
478,A Korean Odyssey,"Lee Seung-gi, Cha Seung-won, Oh Yeon-seo, Lee Hong-gi, Jang Gwang, Lee Se-young",South Korea,2017,"International TV Shows, Korean TV Shows, Romantic TV Shows",A self-serving mythical creature's bid for invincibility backfires when he finds himself at the mercy of a woman who can see otherworldly beings.,https://artworks.thetvdb.com/banners/series/336912/posters/5ed62670c673e.jpg
479,Maggie & Bianca: Fashion Friends,"Emanuela Rei, Giorgia Boni, Sergio Ruggeri, Luca Murphy, Federica Corti, Federico Pedroni, Tiffany Zhou, Sergio Melone",Italy,2017,"Kids' TV, TV Comedies","Originally polar opposites, an American fashion student and the daughter of an industry mogul form an everlasting bond and start a rock band in Milan.",https://artworks.thetvdb.com/banners/posters/316825-1.jpg
480,Trailer Park Boys: The Animated Series,"Mike Smith, John Paul Tremblay, Robb Wells, John Dunsworth, Pat Roach, Cory Bowles, Jacob Rolfe, Tyrone Parsons, Sarah Dunsworth, Jeanna Harrison, Marguerite McNeil",Canada,2019,TV Comedies,"Nova Scotia’s favorite miscreants have always been super sketchy. Now, carrying on from the Season 12 finale, the boys have become complete cartoons.",https://artworks.thetvdb.com/banners/posters/5c9e5ed529d00.jpg
481,"Bure Kaam Bura Natija, Kyun Bhai Chacha Haan Bhatija",,,2017,Kids' TV,"A clever uncle-nephew duo solves mysteries, crimes and other problems for the citizens of a colorful town where something zany is always going down.",na
482,Dandy,"Alfonso Herrera, Damián Alcázar, Gabriela Roel, Itahisa Machado, Dagoberto Gama, Hernán Mendoza, Daniel Martínez, Christian Vasquez, Aleyda Gallardo, Danny Perea, Pakey Vázquez, Fátima Molina, Héctor Holten, Carlos Valencia",Mexico,2016,"Crime TV Shows, International TV Shows, Spanish-Language TV Shows",A law professor is enlisted by Mexico's attorney general to join a special operations unit infiltrating the capital's most notorious drug cartel.,na
483,Th Eena Meena Deeka Chase Comedy Show,"Sanjay Keni, Priya Raina",India,2015,"Kids' TV, TV Comedies","A hungry fox and three resourceful, surprisingly formidable birds turn the animal kingdom on its head in this lively animated series.",na
484,Five Came Back,"Steven Spielberg, Guillermo del Toro, Lawrence Kasdan, Francis Ford Coppola, Paul Greengrass, Meryl Streep",United States,2017,Docuseries,Five acclaimed contemporary directors tell the story of five legendary Hollywood filmmakers who enlisted in the armed forces to document World War II.,https://artworks.thetvdb.com/banners/posters/324824-3.jpg
485,London Spy,"Ben Whishaw, Jim Broadbent, Edward Holcroft, Samantha Spiro, Charlotte Rampling, Lorraine Ashbourne, David Hayman, Clarke Peters, Adrian Lester, Harriet Walter",United Kingdom,2015,"British TV Shows, Crime TV Shows, International TV Shows","When his reclusive-banker lover disappears, a hard-partying young British hedonist plunges into the dangerous world of espionage to find the truth.",https://artworks.thetvdb.com/banners/posters/286179-1.jpg
486,Monkey Planet,George McGavin,United Kingdom,2014,"British TV Shows, Docuseries, Science & Nature TV","Join zoologist Dr. George McGavin for a fascinating, up-close look at the habits and behaviors of primates, our closest animal relatives.",https://artworks.thetvdb.com/banners/series/280301/posters/62070528.jpg
487,North & South,"Daniela Denby-Ashe, Richard Armitage, Tim Pigott-Smith, Sinéad Cusack, Lesley Manville, Brendan Coyle, Anna Maxwell Martin, Jo Joyner, Pauline Quirke, Kay Lyon",United Kingdom,2004,"British TV Shows, Romantic TV Shows, TV Dramas","When her father moves his family to an industrial mill town, the parson's daughter, Margaret Hale, struggles to adapt to her harsh new surroundings.",https://artworks.thetvdb.com/banners/posters/5b02b3ee06805.jpg
488,The Fear,"Peter Mullan, Anastasia Hille, Harry Lloyd, Paul Nicholls, Demosthenes Chrysan, Dragos Bucur, Shaban Arifi, Julia Ragnarsson, Danny Sapani, Nigel Lindsay, Osy Ikhile, Sidney Kean, Lisa McAllister, Catherine Winter, Amarildo Kola, Julius Peter Wells",United Kingdom,2012,"British TV Shows, Crime TV Shows, TV Dramas","Richie Beckett is an aging Brighton crime boss who's struggling with the onset of dementia, just as a rival gang is trying to take over his territory.",https://artworks.thetvdb.com/banners/posters/263731-1.jpg
489,The Great Train Robbery,"Luke Evans, Jim Broadbent, Paul Anderson, Martin Compston, Neil Maskell, Jack Roth, George Costigan, Robert Glenister, Nick Moran, Tim Pigott-Smith, James Fox, James Wilby, Jack Gordon, Nicholas Murchie, Del Synnott, Richard Hope, John Salthouse",United Kingdom,2013,"British TV Shows, Crime TV Shows, International TV Shows","This two-part tale delivers the true story of the Great Train Robbery of 1963, the biggest one in England's history.",https://artworks.thetvdb.com/banners/posters/272804-2.jpg
490,The Murder Detectives,,United Kingdom,2015,"British TV Shows, Crime TV Shows, Docuseries","This series tracks the ups and downs of an 18-month investigation into the 2014 stabbing murder of teenager Nicholas Robinson in Bristol, England.",https://artworks.thetvdb.com/banners/posters/303775-1.jpg
491,Wild Alaska,Dougray Scott,United Kingdom,2015,"British TV Shows, Docuseries, Science & Nature TV","The natural bounty of Alaska sustains its diverse species through extreme weather conditions in three seasons, each with its rewards and challenges.",https://artworks.thetvdb.com/banners/series/384109/posters/5ee9d1475e7ef.jpg
492,Wild Arabia,Alexander Siddig,United Kingdom,2013,"British TV Shows, Docuseries, Science & Nature TV",The widely varied geology and dramatic landscapes in the continental crossroads of Arabia harbors a rich history and an abundance of wildlife.,https://artworks.thetvdb.com/banners/posters/267135-1.jpg
493,Jack Taylor,"Iain Glen, Killian Scott, Nora-Jane Noone, Tara Breathnach, Frank O'Sullivan","United States, Ireland",2016,"Crime TV Shows, International TV Shows, TV Dramas",Ken Bruen's bestselling crime novels leap to life in this series of TV movies featuring Irish cop-turned-private-investigator Jack Taylor.,https://artworks.thetvdb.com/banners/posters/265081-2.jpg
494,Pablo,"Jake Williamson, Rachael Dickson, Sumita Majumdar, Michael White, Tony Finnegan, Scott Mulligan, Rosie King",United Kingdom,2017,"British TV Shows, Kids' TV","Equipped with crayons and his creativity, a boy with autism draws an imaginary world where his animal pals help him tackle real-life situations.",https://artworks.thetvdb.com/banners/posters/335718-1.jpg
495,แผนร้ายนายเจ้าเล่ห์,"Chutavuth Pattarakampol, Sheranut Yusananda, Nichaphat Chatchaipholrat, Thassapak Hsu",,2016,"International TV Shows, Romantic TV Shows, TV Comedies","When two brothers fall for two sisters, they quickly realize the age differences between them are too big to ignore.",na
496,Rapture,"Logic, Nas, Dave West, T.I., G-Eazy, 2 Chainz, Rapsody, Just Blaze, A Boogie Wit tha Hoodie",United States,2018,Docuseries,Groundbreaking artists share their life stories in this vibrant documentary series that captures hip-hop's impact on global culture.,https://artworks.thetvdb.com/banners/posters/342037-2.jpg
497,Trump: An American Dream,Donald Trump,United Kingdom,2018,Docuseries,"Friends, associates and critics reveal the truly American story of Donald Trump, the brash businessman who defied the odds to become U.S. president.",https://artworks.thetvdb.com/banners/posters/337645-1.jpg
498,I Am Me!,"Germán Bracco, Daniela Luque, José Antonio Becerril, Paula Serrano, Héctor Holten, Héctor Loeza, Edson Loyo, Brandon Rosas, José Sefami, Tiosha Bojórquez",Mexico,2016,"International TV Shows, Spanish-Language TV Shows, TV Comedies",Aspiring hip-hop star Francisco builds a name for himself as a musical artist while his conscience helps him through family drama and discrimination.,https://artworks.thetvdb.com/banners/posters/5be036821cb9c.jpg
499,Bitter Daisies,"María Mera, Toni Salgado, Miquel Insua, Denis Gómez, Lucía Álvarez, Sara Sanz, Jimmy Núñez, Paloma Saavedra, Manuel Cortés, Yelena Molina, Ricardo de Barreiro, Nerea Barros, Santiago Cuquejo, Martina Stetson, Carlos Villarino",Spain,2018,"Crime TV Shows, International TV Shows, TV Dramas","While investigating the disappearance of a teen girl in a tight-knit Galician town, a Civil Guard officer uncovers secrets linked to a loss of her own.",https://artworks.thetvdb.com/banners/series/354211/posters/5e93b1205c0d8.jpg
500,Osmosis,"Agathe Bonitzer, Hugo Becker, Gaël Kamilindi, Manoël Dupont, Stéphane Pitti, Luna Silva, Yuming Hey, Suzanne Rault-Balet, Philypa Phoenix, Lena Lapres, Waly Dia, Aurélia Petit, Lionel Lingelser, Fabien Ducommun",France,2019,"International TV Shows, TV Dramas, TV Mysteries","In near-future Paris, two brilliant siblings unveil a high-tech implant designed to pair up soul mates. But the beta test yields unwelcome surprises.",https://artworks.thetvdb.com/banners/posters/5c7f8214958dc.jpg
501,The Terminal,"Mohammad Mansour, Bouthayna Al Raesi, Bassima Hamada, Ahlaam Muhammed, Shaimaa Ali, Foaz Al -Shatti, Abdullah Bahman, Abdulmohsen Al-Qaffas, Mohammed Al Dosari",,2018,"International TV Shows, TV Dramas","Social pressure, a complicated past and a clash of values beset the life of a businessman and his family.",na
502,Traitors,"Emma Appleton, Michael Stuhlbarg, Luke Treadaway, Keeley Hawes, Brandon P. Bell, Matt Lauria, Jamie Blackley, David Hargreaves, Sam Hoare, Simon Kunz, Greg McHugh, Stephen Campbell Moore, Cara Horgan",United Kingdom,2019,"British TV Shows, International TV Shows, TV Dramas","As World War II ends, a young English woman agrees to help an enigmatic American agent root out Russian infiltration of the British government.",https://artworks.thetvdb.com/banners/posters/5c69eb5fab3e2.jpg
503,All American,"Daniel Ezra, Taye Diggs, Samantha Logan, Bre-Z, Greta Onieogou, Monet Mazur, Michael Evans Behling, Cody Christian, Karimah Westbrook, Jalyn Hall, Jordan Belfi, Briana Lane",United States,2019,"TV Dramas, Teen TV Shows",Culture clashes and brewing rivalries test a teen football player from South Los Angeles when he’s recruited to the Beverly Hills High School team.,https://artworks.thetvdb.com/banners/posters/5d8eba2585a1c.jpg
504,Ollie & Moon,"Mattea Conforti, Kobi Frumer",France,2018,Kids' TV,"Two quirky cats, Ollie and Moon, and their friend Stanley the snail travel the world, solving everyday problems and learning about different cultures.",https://artworks.thetvdb.com/banners/posters/5d016805ef9a5.jpg
505,James Acaster: Repertoire,James Acaster,United Kingdom,2018,"British TV Shows, International TV Shows, Stand-Up Comedy & Talk Shows","Offbeat comic James Acaster covers the strange, the mundane and everything in between in this collection of four wide-ranging stand-up specials.",https://artworks.thetvdb.com/banners/posters/345143-1.jpg
506,The Eagle of El-Se'eed,"Mohamed Ramadan, Sayed Rajab, Dorra Zarrouk, Dina Talaat, Aida Reyad",,2018,"Crime TV Shows, International TV Shows, TV Action & Adventure","A police officer and a drug lord become embroiled in a cycle of revenge, each man bent on taking the other down.",na
507,"Drugs, Inc.",Mike Secher,United States,2015,"Crime TV Shows, Docuseries","This absorbing documentary series follows the entire supply chain of the illicit drug trade, tracing its production, export, sale and consumption.",https://artworks.thetvdb.com/banners/series/174501/posters/5e934612e5929.jpg
508,Day and Night,"Pan Yueming, Wang Longzheng, Liang Yuen, Lü Xiaolin, Yin Shuyi, Hou Xuelong, Song Naigang",China,2017,"Crime TV Shows, International TV Shows, TV Dramas",A detective assists with an investigation into a brutal mass murder case in which his twin brother is the prime suspect.,https://artworks.thetvdb.com/banners/posters/334769-1.jpg
509,Requiem,"Lydia Wilson, Joel Fry, Brendan Coyle, James Frecheville, Claire Rushbrook, Joanna Scanlan, Pippa Haywood, Tara Fitzgerald, Richard Harrington, Sian Reese-Williams",United Kingdom,2018,"British TV Shows, International TV Shows, TV Dramas","In the wake of a sudden tragedy, a London cellist unearths secrets that link her mother to the disappearance of a young girl in a small Welsh town.",https://artworks.thetvdb.com/banners/posters/341477-1.jpg
510,Charlie's Colorforms City,"Jacob Soley, Saara Chaudry, Tyler Barish, Zoe Hatz, Julie Lemieux, Joseph Motiki, Shoshana Sperling, Adrianna Di Liello, Deann Degruijter, Stacey DePass",United States,2019,Kids' TV,"Charlie creates fun stories using different shapes, and he needs your help! Take off for adventures in outer space, the Wild West – and right at home.",https://artworks.thetvdb.com/banners/posters/5c97b2f64583a.jpg
511,Crime Diaries: The Candidate,"Jorge A. Jiménez, Ilse Salas, Alberto Guerra, Gustavo Sánchez Parra, Jorge Antonio Guerrero, Ari Brickman, Martín Altomaro, Hernán Del Riego, Norma Angélica, Lisa Owen, Eligio Meléndez, Marco Treviño, Pedro de Tavira Egurrola, Leonardo Alonso",Mexico,2019,"Crime TV Shows, International TV Shows, Spanish-Language TV Shows","In 1994, Mexican presidential candidate Luis Donaldo Colosio's assassination sends his dying widow racing to uncover who did it. Based on true events.",https://artworks.thetvdb.com/banners/posters/5c94c0a0ca3da.jpg
512,Delhi Crime,"Shefali Shah, Rajesh Tailang, Rasika Dugal, Adil Hussain, Vinod Sharawat, Mridul Sharma, Gopal Dutt Tiwari, Anurag Arora, Gaurav Rana, Yashaswini Dayama",India,2019,"Crime TV Shows, International TV Shows, TV Dramas","As Delhi reels in the aftermath of a gang rape, DCP Vartika Chaturvedi leads a painstaking search for the culprits. Based on the 2012 Nirbhaya case.",https://artworks.thetvdb.com/banners/posters/5c97e70769213.jpg
513,Most Beautiful Thing,"Maria Casadevall, Pathy Dejesus, Fernanda Vasconcellos, Mel Lisboa, Leandro Lima, Ícaro Silva, Gustavo Vaz, Alexandre Cioletti, Gustavo Machado",Brazil,2019,"International TV Shows, Romantic TV Shows, TV Dramas","A 1950s housewife goes to Rio de Janeiro to meet up with her husband, only to learn he's deserted her, but decides to stay and open a bossa nova club.",https://artworks.thetvdb.com/banners/posters/5c97e383eb42d.jpg
514,Selling Sunset,,,2019,Reality TV,The elite real estate brokers at The Oppenheim Group sell the luxe life to affluent buyers in LA. The drama ramps up when a new agent joins the team.,https://artworks.thetvdb.com/banners/series/361394/posters/5ec2f9bfdc3ac.jpg
515,The 10 Sins,"Abdul Mohsen Alnimer, Haifa Hussien, Qahtan Alqahtani, Mohammed Sefer, Abdulla Bu Shehri",,2018,"International TV Shows, TV Dramas","In this social drama of sin and remorse, a man reels at the discovery that his wife has been unfaithful, and gives her an ultimatum.",na
516,Bo on the Go!,"Catherine O'Connor, Andrew Sabiston, Jim Fowler",Canada,2007,Kids' TV,"Staying at home doesn't mean sitting still for energetic Bo and her little dragon friend Dezzy, who embark on amazing adventures through movement.",https://artworks.thetvdb.com/banners/posters/129011-2.jpg
517,Stay Tuned!,"Kyoko Yoshine, Hiroki Iijima, Kanako Miyashita, Yo Oizumi, Ken Yasuda",Japan,2019,"International TV Shows, TV Comedies, TV Dramas","She's the most unlikely candidate to ever stumble into the role of a reporter, and she’s keeping everyone on their toes with her eccentric ways.",https://artworks.thetvdb.com/banners/posters/5ca3bde19f44d.jpg
518,Dave Chappelle,Dave Chappelle,United States,2017,"Stand-Up Comedy & Talk Shows, TV Comedies","Comedy icon Dave Chappelle makes his triumphant return to the screen with a pair of blistering, fresh stand-up specials.",https://artworks.thetvdb.com/banners/posters/257136-1.jpg
519,Feb-09,"Shahd El Yaseen, Shaila Sabt, Hala, Hanadi Al-Kandari, Salma Salem, Ibrahim Al-Harbi, Mahmoud Boushahri, Yousef Al Balushi, Ghorour, Abdullah Al-bloshi",,2018,"International TV Shows, TV Dramas","As a psychology professor faces Alzheimer's, his daughter and her three close female friends experience romance, marriage, heartbreak and tragedy.",na
520,My Husband Won't Fit,"Natsumi Ishibashi, Aoi Nakamura",Japan,2019,"International TV Shows, Romantic TV Shows, TV Dramas","Kumiko and Kenichi meet in college and build a happy marriage together. But over time, an unusual problem threatens to destroy their relationship.",https://artworks.thetvdb.com/banners/posters/5c93bc3ad0782.jpg
521,Juana Brava,"Elisa Zulueta, Alejandro Trejo, Lucas Balmaceda, Gastón Salgado, Nelson Brodt, Emilia Noguera, Daniel Guillón, Ángela Lineros",Chile,2015,"International TV Shows, Spanish-Language TV Shows, TV Dramas","After many years away, a woman returns to her hometown, where her mayor father presides over a corrupt, lawless and rundown municipality.",na
522,One-Punch Man,"Makoto Furukawa, Kaito Ishikawa, Yuki Kaji, Aoi Yuki, Kazuhiro Yamaji, Kenjiro Tsuda, Minami Takayama, Tessho Genda",Japan,2015,"Anime Series, Crime TV Shows, International TV Shows","The most powerful superhero in the world can kill anyone with one blow. But nothing can challenge him, so he struggles with ennui and depression.",https://artworks.thetvdb.com/banners/posters/293088-2.jpg
523,The Guild,"Felicia Day, Sandeep Parikh, Jeff Lewis, Robin Thorsen, Amy Okuda, Vincent Caso","United States, Japan",2013,TV Comedies,Fantasy and reality collide when a surprisingly diverse group of online video-game addicts struggle to balance the game with personal relationships.,https://artworks.thetvdb.com/banners/posters/83949-4.jpg
524,B: The Beginning,"Hiroaki Hirata, Yuki Kaji, Asami Seto, Hiroki Touchi, Minoru Inaba, Ami Koshimizu, Toshiyuki Toyonaga, Shintaro Tanaka, Atsushi Goto, Toshiyuki Morikawa, Kaito Ishikawa, Satomi Sato, Yu Kitada, Mitsuki Saiga, Kazuya Nakai, Nozomi Kameda, Makoto Awane",Japan,2018,"Anime Series, Crime TV Shows, International TV Shows","Genius investigator Keith Flick rejoins the royal police force just as serial killer ""B"" emerges. Mysterious youth Koku may be an ally, or a target.",https://artworks.thetvdb.com/banners/posters/339353-3.jpg
525,Flint Town,,United States,2018,"Docuseries, Science & Nature TV","Over a two-year period, filmmakers embedded with cops in Flint, Michigan, reveal a department grappling with volatile issues in untenable conditions.",https://artworks.thetvdb.com/banners/posters/343305-1.jpg
526,Green Door,"Jam Hsiao, Bea Hayden Kuo, Enno Cheng, Hsieh Ying-xuan, Jason King, Lan Wei-Hua, Shen Hai Jung, Ruby Zhan, Blue Lan",Taiwan,2019,"International TV Shows, Romantic TV Shows, TV Comedies","A troubled psychologist returns from the U.S. and sets up a clinic in Taiwan, where mysterious patients and uncanny events shed light on his murky past.",https://artworks.thetvdb.com/banners/posters/5c66e27f4b0a8.jpg
527,Julie's Greenroom,"Julie Andrews, Giullian Yao Gioiello, Jennifer Barnhart, Tyler Bunch, Frankie Cordero, Stephanie D'Abruzzo, Dorien Davies, John Kennedy, John Tartaglia",United States,2017,Kids' TV,Adorable puppets stage their own musical under the watchful eye of mentor Julie Andrews in this original kids' series from the Jim Henson Company.,https://artworks.thetvdb.com/banners/posters/313883-2.jpg
528,Samurai Gourmet,"Naoto Takenaka, Tetsuji Tamayama, Honami Suzuki",Japan,2017,"International TV Shows, TV Dramas",Recent retiree Takeshi rediscovers his passion for food and life by getting in touch with his inner warrior and eating what he truly desires.,https://artworks.thetvdb.com/banners/posters/5d0e667f281b5.jpg
529,Edha,"Juana Viale, Andrés Velencoso, Delfina Chaves, Osmar Nuñez, Germán Palacios, Juan Pablo Geretto, Sofía Gala, Daniel Pacheco, Daniel Hendler, Flavio Mendoza",Argentina,2018,"International TV Shows, Spanish-Language TV Shows, TV Dramas","Revenge, passion and dark secrets push a successful fashion designer and single mother to her limits when she meets a handsome and mysterious man.",https://artworks.thetvdb.com/banners/posters/341879-1.jpg
530,Wild Wild Country,,United States,2018,"Crime TV Shows, Docuseries","When a controversial cult leader builds a utopian city in the Oregon desert, conflict with the locals escalates into a national scandal.",https://artworks.thetvdb.com/banners/posters/342040-1.jpg
531,Hotel Beau Séjour,"Lynn Van Royen, Inge Paulussen, Jan Hammenecker, Kris Cuppens, Johan van Assche, Katrin Lohmann, Mieke De Groote, Roel Vanderstukken, Joren Seldeslachts, Joke Emmers, Charlotte Timmers, Guus Bullen, Tiny Bertels, Reinhilde Decleir, Barbara Sarafian",Belgium,2017,"Crime TV Shows, International TV Shows, TV Dramas","Caught in an afterlife limbo, teenage Kato investigates her own mysterious death and unravels a web of secrets in her seemingly tranquil village.",na
532,If I Hadn't Met You,"Pablo Derqui, Mercedes Sampietro, Andrea Ros, Javier Beltrán, Paula Malia, David Vert, Muguet Franc, Miquel García Borda, Berta Garcia, Joel Bramona, Montse Guallar, Abel Folk, Sergi López, Òscar Jarque, Eli Iranzo",Spain,2018,"International TV Shows, Romantic TV Shows, TV Dramas","Eduard, a husband and father who loses his family in a tragic accident, travels to parallel universes to seek a better fate for his beloved wife.",https://artworks.thetvdb.com/banners/posters/5bc720f965070.jpg
533,"Love, Death & Robots","Topher Grace, Mary Elizabeth Winstead, Gary Cole, Samira Wiley, Daisuke Tsuji, Maurice LaMarche, Rebecca Riedy, Helen Sadler, Hayley McLaughlin, Time Winters, Elly Condron, Stefan Kapicic, Bruce Thomas, Jeff Berg, Aaron Himelstein, Carlos Alazraqui, Jill Talley, Brian Bloom, Chris Cox, Michael Benyaer, Fred Tatasciore, Scott Whyte, Josh Brener, Gary Anthony Williams, Chris Parnell, Graham Hamilton, Adam Bartley, Kevin Michael Richardson, Emma Thornett, Henry Douthwaite, Madeleine Knight, Rebecca Banatvala, Kirk Thornton, Yuri Lowenthal, Elaine Tan, Matthew Yang King, Gwendoline Yeo, Neil Kaplan, G.K. Bowes, Courtenay Taylor",United States,2019,"TV Action & Adventure, TV Horror, TV Sci-Fi & Fantasy","Terrifying creatures, wicked surprises and dark comedy converge in this NSFW anthology of animated stories presented by Tim Miller and David Fincher.",https://artworks.thetvdb.com/banners/posters/5c8e831fd8a2c.jpg
534,My Pride,"Khaled Amin, Elham Al Fadalah, Fatima Al Safi, Fahad Basim, Farah ElSaraf, Hala",,2018,"International TV Shows, TV Dramas","After their mother's death, Amal and her brothers struggle to live with their authoritarian father, whose cruelty and neglect break the family apart.",na
535,The Disappearance of Madeleine McCann,,,2019,"Crime TV Shows, Docuseries","The documentary takes a detailed look at the disappearance of 3-year-old Madeleine McCann, who vanished while on holiday with her family.",https://artworks.thetvdb.com/banners/posters/5c8be09c51847.jpg
536,Top 10 Secrets and Mysteries,,"United Kingdom, United States, Czech Republic",2018,"British TV Shows, Docuseries, Science & Nature TV","This series investigates mysteries that persistently elude scientific explanation, such as mythical creatures, UFOs, sacred sites and more.",https://artworks.thetvdb.com/banners/posters/330829-1.jpg
537,Turn Up Charlie,"Idris Elba, Piper Perabo, JJ Feild, Frankie Hervey, Guz Khan",United Kingdom,2019,"British TV Shows, International TV Shows, TV Comedies",A down-and-out DJ plots to rebuild his music career while working as a nanny for his famous best friend's wild 11-year-old daughter.,https://artworks.thetvdb.com/banners/posters/5c77fd1462790.jpg
538,Khotey Sikkey,"Vikas Kumar, Hassan Zaidi, Sukhmani Sadana, Puru Chibber, Dilkhush, Mark Farokh Parakh",India,2011,"Crime TV Shows, International TV Shows, TV Dramas",Five affluent youths find a new sense of purpose as they team up with a Mumbai police officer on crime-busting missions around the city.,https://artworks.thetvdb.com/banners/posters/320490-1.jpg
539,Mystery Science Theater 3000,"Joel Hodgson, Michael J. Nelson, Kevin Murphy, Trace Beaulieu, Jim Mallon, Frank Conniff, Mary Jo Pehl, Bill Corbett, Patrick Brantseg, J. Elvis Weinstein",United States,1999,"TV Comedies, TV Sci-Fi & Fantasy",Hosts Joel and Mike and their robot companions offer hilarious running commentary on B movies they're forced to watch in these classic MST3K episodes.,https://artworks.thetvdb.com/banners/posters/74806-3.jpg
540,Rishta.com,"Shruti Seth, Kavi Shastri, Siddhant Karnick, Kavin Dave",India,2010,"International TV Shows, Romantic TV Shows, TV Comedies",Partners at an Indian matrimonial agency face endlessly challenging and often impossible demands as they help clients make the perfect match.,https://artworks.thetvdb.com/banners/posters/142281-1.jpg
541,Secret of the Nile,"Amr Youssef, Dina El-Sherbiny, Anoushka, Amina Khalil, Nada Mousa, Sawsan Badr, Ahmed Dawood",Egypt,2016,"International TV Shows, Romantic TV Shows, TV Dramas","When his sister disappears while working at the Grand Hotel, a man joins the staff to get answers. Inside its posh walls, he finds love and intrigue.",https://artworks.thetvdb.com/banners/posters/313759-2.jpg
542,Tabula Rasa,"Veerle Baetens, Stijn Van Opstal, Jeroen Perceval, Hilde Van Mieghem, Gene Bervoets, Peter Van den Begin, Natali Broods",Belgium,2017,"International TV Shows, TV Dramas, TV Mysteries","When a young woman with amnesia becomes a key figure in a missing persons case, she must reconstruct her memories to clear her name.",https://artworks.thetvdb.com/banners/posters/329362-2.jpg
543,Oscar's Oasis,,France,2011,Kids' TV,"Plucky lizard Oscar spends his time trying to avoid the hazards of the desert, including marauding chickens and bumbling adversaries.",https://artworks.thetvdb.com/banners/posters/250756-2.jpg
