TV_id,title,cast,country,release_year,listed_in,description,URL
952,Happy!,"Christopher Meloni, Lili Mirojnick, Glenn Wein, Patrick Fischler, Toby Jaffe, Ritchie Coster, Grant Morrison, Pavun Shetty, Medina Senghore, Patton Oswalt",United States,2017,"Crime TV Shows, TV Action & Adventure, TV Comedies",A boozy ex-cop turned hit man thinks he's losing his marbles when a cartoon unicorn only he can see urges him to rescue a girl kidnapped by Santa.,https://artworks.thetvdb.com/banners/posters/328361-4.jpg
953,Home for Christmas,"Ida Elise Broch, Gabrielle Susanne Solheim Leithaug, Dennis Storhøi, Anette Hoff, Felix Sandman, Ghita Nørby, Hege Schøyen, Bjørn Skagestad, Mads Sjøgård Pettersen",Norway,2019,"International TV Shows, Romantic TV Shows, TV Comedies","Tired of the constant comments on her relationship status, perpetually single Johanne starts a 24-day hunt for a boyfriend to bring home for Christmas.",https://artworks.thetvdb.com/banners/series/368597/posters/62016073.jpg
954,V Wars,"Ian Somerhalder, Adrian Holmes, Jacky Lai, Kyle Breitkopf, Peter Outerbridge, Kimberly-Sue Murray, Sydney Meyer, Kandyse McClure, Laura Vandervoort, Michael Greyeyes, Greg Bryk, Teddy Moynihan, Ted Atherton, Jonathan Higgins, Nikki Reed, Samantha Liana Cole, Laura de Carteret, Bo Martyn",Canada,2019,"TV Action & Adventure, TV Dramas, TV Horror",A fast-spreading disease that turns victims into blood-sucking fiends pits two best friends against each other in a fight for humanity's future.,https://artworks.thetvdb.com/banners/series/371610/posters/62051355.jpg
955,Cleo & Cuquin,,Spain,2018,Kids' TV,Spirited sister-brother duo Cleo and Cuquín try on different professions each day to help their other siblings solve problems and enjoy new adventures.,https://artworks.thetvdb.com/banners/posters/5bd56cb5708b6.jpg
956,The Last O.G.,"Tracy Morgan, Tiffany Haddish, Cedric the Entertainer, Allen Maldonado, Ryan Gaul, Taylor Mosby, Dante Hoagland, Joel Marsh Garland, Gino Vento, Derek Gaines, Daniel J. Watts, Malik Yoba, Edi Patterson",United States,2018,TV Comedies,"After 15 years behind bars, a kindhearted ex-drug dealer returns to Brooklyn looking for a fresh start, only to discover things have changed. A lot.",https://artworks.thetvdb.com/banners/posters/332439-1.jpg
957,The Prince of Tennis ~ Match! Tennis Juniors ~,"Peng Yuchang, Dong Li, Zhang Yijie, Xie Binbin, Zhu Zhiling, Xu Ke, Wu Xudong, Li He, Fan Linfeng",China,2019,"International TV Shows, TV Dramas, Teen TV Shows",A tennis whiz beats the odds to excel on the court while juggling school and inspiring teammates. Based on the hit manga series by Takeshi Konomi.,https://artworks.thetvdb.com/banners/posters/5d355c68d766e.jpg
958,The Road to Love,"Katherine Escobar Farfan, Juan Manuel Restrepo, César Mora, Mario Espitia, Carmenza González, José Daniel Cristancho, Felipe Bernedette, Camilo Amores, Linda Lucía Callejas, Fernando Solórzano, María Laura Quintero, Toto Vega, Mayra Luna, Ana María Cuéllar, María Fernanda Matus",,2019,"International TV Shows, Romantic TV Shows, Spanish-Language TV Shows","After an argument with her dad, a young woman from a family of macho truck drivers is kicked out of the home and must make her own success as a trucker.",https://artworks.thetvdb.com/banners/series/373190/posters/5ebef56bd405d.jpg
959,ARASHI's Diary -Voyage-,Arashi,,2019,"Docuseries, International TV Shows","Twenty years after their debut, join the beloved members of Arashi on a new journey as they showcase their lives, talents and gifts to the world.",https://artworks.thetvdb.com/banners/series/374690/posters/5ecf0969e9454.jpg
960,Pucca: Love Recipe,"Jeonghwa Yang, Yongwoo Shin, Doug Erholtz, Melissa Fahn, Karen Strassman, Kirk Thornton, Spike Spencer",,2018,"Kids' TV, Korean TV Shows","Faced with a threat to the survival of her family restaurant, as well as a rival for Garu's heart, Pucca fights for all that she loves.",https://artworks.thetvdb.com/banners/series/375231/posters/62044209.jpg
961,Rainbow Ruby,"Alyssya Swales, Shannon Chan-Kent, Brian Drummond, Olivia Charles, Kate Higgins, Johnny Yong Bosch","South Korea, Canada, United States, China",2016,Kids' TV,"Ruby makes magical journeys with her teddy bear Choco to Rainbow Village, where her toys come to life – and where there's always a problem to solve!",https://artworks.thetvdb.com/banners/posters/314976-1.jpg
962,The Neighbor,"Quim Gutiérrez, Clara Lago, Adrián Pino, Catelina Sopelana",Spain,2019,"International TV Shows, Spanish-Language TV Shows, TV Comedies",Self-centered Javier's life gets a bit messy when he unexpectedly becomes a superhero – and his recent ex is tasked with uncovering his identity.,https://artworks.thetvdb.com/banners/series/372637/posters/62036210.jpg
963,Yanxi Palace: Princess Adventures,"Wang Herun, Wang Yizhe, Wang Yuwei, Xu Xiaonuo, Wu Jinyan, Nie Yuan",,2019,"International TV Shows, TV Dramas",A determined Qing dynasty princess contends with palace intrigue and a vendetta against her family while navigating the treacherous terrain of romance.,https://artworks.thetvdb.com/banners/series/374619/posters/62038577.jpg
964,Conan Without Borders,,United States,2018,"Docuseries, TV Comedies",Late-night talk show host Conan O'Brien hits the road in this special that brings him and his sense of humor to far-flung destinations.,https://artworks.thetvdb.com/banners/posters/342722-1.jpg
965,For the Win,Brodie Smith,,2017,Reality TV,Frisbee national champion Brodie Smith challenges inventive athletes across the US to an exhibition match in the unconventional sports they've created.,na
966,Inst@famous,,United Kingdom,2018,Reality TV,Self-made social media celebrities share the stories of how they built their online empires and where they plan to take their unexpected fame next.,https://artworks.thetvdb.com/banners/posters/5c474bcbdf410.jpg
967,Slobby's World,Robert Hall,United States,2018,Reality TV,Welcome to the irreverent world of Robert Hall – aka Slobby Robby – a pop culture junkie who buys and sells collectable goods from the '80s and '90s.,https://artworks.thetvdb.com/banners/posters/5b46432fce555.jpg
968,Bat Pat,"Rosa Romay, Alberto Escobal, Jaime de Diego, Josu Cubero",Italy,2016,Kids' TV,"A curious and talkative bat finds spooky fun on the streets of Fogville, a town that's not as quiet as it seems, with a plucky girl and her brothers.",https://artworks.thetvdb.com/banners/posters/5c2bfe0fae92e.jpg
969,Dave Chappelle: Equanimity & The Bird Revelation,Dave Chappelle,United States,2017,"Stand-Up Comedy & Talk Shows, TV Comedies","Comedy titan Dave Chappelle caps a wild year with two stand-up specials packed with scorching new material, self-reflection and tough love.",na
970,El Chavo,"Roberto Gómez Bolaños, María Antonieta de las Nieves, Carlos Villagrán, Florinda Meza García, Angelines Fernández Abad, Rubén Aguirre Fuentes, Edgar Vivar, Ramón Gómez Valdez de Castillo",Mexico,1979,"Classic & Cult TV, Kids' TV, Spanish-Language TV Shows","El Chavo is a poor, nameless orphan who lives in an apartment building with La Chilindrina, Quico, Doña Florinda, Don Ramón and Professor Jirafales.",https://artworks.thetvdb.com/banners/posters/300199-1.jpg
971,Geronimo Stilton,"Brian Drummond, Erin Mathews, Richard Ian Cox, Sarah Edmondson, Moneca Stori","Italy, Canada, France",2011,"Kids' TV, TV Comedies","With the help of brainy and adventurous sidekicks, New Mouse City's favorite journalist investigates mysteries that take him around the world,",https://artworks.thetvdb.com/banners/posters/136221-1.jpg
972,Lo que la vida me robó,"Angelique Boyer, Sebastián Rulli, Luis Roberto Guzmán, Osvaldo Benavides, Daniela Castro, Ana Bertha Espín, Gabriela Rivero, Alejandro Ávila, Alejandra García, Carlos de la Mota, Sergio Sendel, Ferdinando Valencia, Grettell Valdez, Verónica Jaspeado, Margarita Magaña, Alexis Ayala, Alejandra Procuna, Juan Carlos Barreto",Mexico,2013,"Crime TV Shows, International TV Shows, Romantic TV Shows","In seaside Aguazul, beautiful Montserrat and her wily mother tangle with lovers, gangsters, financial ruin, obsession – and murder.",https://artworks.thetvdb.com/banners/posters/280059-2.jpg
973,Rebelde,"Anahí, Dulce María, Alfonso Herrera, Christopher Von Uckermann, Maite Perroni, Christian Chávez, Juan Ferrara, Ninel Conde, Leticia Perdigón, Enrique Rocha",Mexico,2004,"International TV Shows, Romantic TV Shows, Spanish-Language TV Shows","Six students at an exclusive prep school, some on scholarship, discover that music can close the class divide.",https://artworks.thetvdb.com/banners/posters/80401-4.jpg
974,Rubi,"Bárbara Mori, Eduardo Santamarina, Sebastián Rulli, Jacqueline Bracamontes, Ana Martín, Yadhira Carrillo, Miguel Pizarro, Manuel Landeta, Antonio Medellin, Ana Bertha Espín, José Elías Moreno, Olivia Bucio",Mexico,2004,"International TV Shows, Romantic TV Shows, Spanish-Language TV Shows","Ruby, jealous of her wealthy best friend Maribel, cooks up a scheme to marry a millionaire. Hector, Maribel's boyfriend, is her target.",https://artworks.thetvdb.com/banners/posters/276171-3.jpg
975,Teresa,"Angelique Boyer, Sebastián Rulli, Aarón Díaz, Cynthia Klitbo, Ana Brenda Contreras, Daniel Arenas, Margarita Magaña, Manuel Landeta, Felicia Mercado, Silvia Mariscal",Mexico,2010,"International TV Shows, Romantic TV Shows, Spanish-Language TV Shows","We all want so much more than we have, but how far are we willing to go to get it?",https://artworks.thetvdb.com/banners/posters/248269-1.jpg
976,Battle Creek,"Josh Duhamel, Dean Winters, Aubrey Dollar, Edward Fordham Jr., Kal Penn, Janet McTeer, Liza Lapira, Damon Herriman, Meredith Eaton",United States,2015,"Crime TV Shows, TV Comedies, TV Dramas","A polished FBI agent must team up with a cynical cop when he's dispatched to Battle Creek, Michigan, to set up an office at the local precinct.",https://artworks.thetvdb.com/banners/posters/274802-4.jpg
977,The Disastrous Life of Saiki K.: Reawakened,"Hiroshi Kamiya, Daisuke Ono, Nobunaga Shimazaki, Satoshi Hino, Natsuki Hanae, Ai Kayano, Yukari Tamura, Maaya Uchida, Yoshimasa Hosoya, Masaya Matsukaze, Tomoaki Maeno, Kenji Nojima, Mitsuo Iwata, Rikako Aikawa, Yuki Kaji, Eri Kitamura, M・A・O, Kensho Ono, Kohsuke Toriumi, Nao Toyama",,2019,"Anime Series, International TV Shows","Kusuo and his gaggle of self-proclaimed friends are back for more psychic mishaps. If he didn't have enough problems before, he's got even more now.",https://artworks.thetvdb.com/banners/posters/313435-1.jpg
978,Pioneers: First Women Filmmakers*,,,1925,TV Shows,"This collection restores films from women who tackled hot-button issues, transcended norms, and left a mark on the history of cinema and the industry.",na
979,My Runway,"Ji-yeon Park, Dong-ho Kang, Chul-woong Kang, Bo-hyun Ahn, Hak Jin, Se-jin Park, Kisum",South Korea,2016,"International TV Shows, Korean TV Shows, Romantic TV Shows",An egotistic top male model and a pretty model wannabe are forced to live each other's lives until they figure out a way to undo their body switch.,https://artworks.thetvdb.com/banners/series/322421/posters/5eaf59b5ceb22.jpg
980,Blue Planet II,David Attenborough,United Kingdom,2017,"British TV Shows, Docuseries, Science & Nature TV","This sequel to the award-winning nature series ""Blue Planet"" dives beneath Earth's oceans to reveal the dazzling vistas and amazing creatures there.",https://artworks.thetvdb.com/banners/posters/330942-1.jpg
981,In Family We Trust,"Songsit Roongnophakunsri, Saksit Tangtong, Kathaleeya McIntosh, Sopitnapa Choompanee, Apasiri Nitibhon, Phollawat Manuprasert, Nappon Gomarachun, Patravadi Mejudhon, Kejmanee Wattanasin, Supoj Chancharoen, Pimmara Charoenpakdee, Thanapob Leeratanakajorn, Kritsanapoom Pibulsonggram, Teeradon Supapunpinyo, Kongyingyong Chonlathorn, Lapat Ngamchaweng, Sivakorn Adulsuttikul, Paris Intarakomalyasut, Jackrin Kungwankiatichai, Vachirawich Aranthanawong, Sawanya Paisarnpayak, Kanyawee Songmuang, Pitisak Yaowananon, Chavalit Chittanant, Thaneth Warakulnukroh",Thailand,2018,"Crime TV Shows, International TV Shows, TV Dramas","When the head of the lucrative family business passes away, his will leaves the clan at extreme odds.",https://artworks.thetvdb.com/banners/posters/5d4a3883cd078.jpg
982,La Mante,"Carole Bouquet, Fred Testot, Pascal Demolon, Manon Azem, Frédérique Bel, Élodie Navarre, Jacques Weber",France,2017,"Crime TV Shows, International TV Shows, TV Dramas","Decades after her capture, a serial killer offers to help solve a string of copycat murders – but only if her son, now a cop, will work by her side.",https://artworks.thetvdb.com/banners/posters/322885-2.jpg
983,The Real Football Factories,Danny Dyer,United Kingdom,2006,"British TV Shows, Docuseries, International TV Shows",Examine the troubling history of football hooliganism and hear from real hooligans about their bitter rivalries and rowdiest brawls.,https://artworks.thetvdb.com/banners/posters/80940-1.jpg
984,Wadi,"Syafie Naswip, Ardell Aryana, Naim Daniel, Shafieq Shazwan, Fimie Don, Afieq Syazwan, Amyza Aznan, Azhan Rani, Ahmad Iswazir",,2015,"International TV Shows, TV Dramas","After the death of his father, a passive and good-natured teenager named Wadi struggles with family, work and love.",na
985,Hashoter Hatov,"Moshe Ivgy, Guy Loel, Yuval Semo, Yigal Adika, Avi Shnaidman, Vered Feldman, Liora Rivlin",Israel,2015,"Crime TV Shows, International TV Shows, TV Comedies",An honest – though overzealous – police officer strives to do good work while dealing with his bickering parents and incompetent coworkers.,https://artworks.thetvdb.com/banners/posters/298711-2.jpg
986,Murder Mountain,,United States,2018,"Crime TV Shows, Docuseries","In Humboldt County, California, the big business of legal marijuana brings in visitors from around the world. Some are never seen again.",https://artworks.thetvdb.com/banners/series/355843/posters/5eb56060643b0.jpg
987,Selection Day,"Mohammad Samad, Yash Shashank Dholye, Rajesh Tailang, Mahesh Manjrekar, Karanvir Malhotra, Ratna Pathak Shah, Akshay Oberoi",India,2018,"International TV Shows, TV Dramas, Teen TV Shows",Two teen cricket prodigies struggle against their overbearing father and a system stacked against them to realize their own ambitions and identities.,https://artworks.thetvdb.com/banners/posters/5bf7cfd0bbfb5.jpg
988,Kevin Hart: Don’t F**k This Up,,United States,2019,Docuseries,"Amid turmoil in his career and marriage, comedian and film star Kevin Hart opens up about his personal breakthroughs as he navigates crises and fame.",na
989,The Gift,"Beren Saat, Mehmet Günsür, Metin Akdülger, Melisa Şenolsun, Başak Köklükaya, Civan Canova, Tim Seyfi, Meral Çetinkaya, Hazal Türesan, Cezmi Baskın",Turkey,2019,"International TV Shows, TV Dramas, TV Mysteries",A painter in Istanbul embarks on a personal journey as she unearths universal secrets about an Anatolian archaeological site and its link to her past.,https://artworks.thetvdb.com/banners/posters/291908-1.jpg
990,Towies,,,2016,"International TV Shows, Reality TV",Australia's toughest tow truck operators work to keep Queensland's streets clear of overturned semis and other automotive disasters.,https://artworks.thetvdb.com/banners/posters/341211-1.jpg
991,Chasing Cameron,"Cameron Dallas, Aaron Carpenter, Taylor Caniff, Willie Jones, Trey Schafer, Bart Bordelon, Blake Gray",United States,2016,"Reality TV, Teen TV Shows",Go behind the scenes with social media sensation Cameron Dallas as he takes his career to the next level on an international tour.,https://artworks.thetvdb.com/banners/posters/320983-3.jpg
992,Fast & Furious Spy Racers,"Tyler Posey, Charlet Chung, Jorge Diaz, Camille Ramsey, Luke Youngblood, Renée Elise Goldsberry",United States,2019,Kids' TV,A government agency recruits teen driver Tony Toretto and his thrill-seeking friends to infiltrate a criminal street racing circuit as undercover spies.,https://artworks.thetvdb.com/banners/series/372498/posters/62001595.jpg
993,The Bonfire of Destiny,"Audrey Fleurot, Julie de Bona, Camille Lou, Gilbert Melki, Josiane Balasko, Antoine Duléry, Florence Pernel, Théo Fernandez, Victor Meutelet, François-David Cardonnel, Stéphane Guillon, Aurélien Wiik, Gilles Cohen",France,2019,"International TV Shows, TV Dramas","After a devastating fire in 1897 Paris, three women find their lives upended by betrayals, deceptions and romantic turmoil. Inspired by real events.",https://artworks.thetvdb.com/banners/series/366240/posters/62034494.jpg
994,You,"Penn Badgley, Elizabeth Lail, Shay Mitchell, John Stamos, Luca Padovan, Zach Cherry",United States,2018,"Crime TV Shows, Romantic TV Shows, TV Dramas","Obsessed with an aspiring writer, a charming bookstore manager goes to extreme measures to insert himself into her life.",https://artworks.thetvdb.com/banners/posters/5bd8ff1b472b2.jpg
995,Ezel,"Kenan İmirzalıoğlu, Cansu Dere, Haluk Bilginer, Yiğit Özşener, Barış Falay, Burçin Terzioğlu, Bade İşçil, Sarp Akkaya, İpek Bilgin, Salih Kalyon, Tuncel Kurtiz, Sedef Avcı, Berrak Tüzünataç, İsmail Filiz",Turkey,2009,"Crime TV Shows, International TV Shows, TV Dramas",A young man framed for a crime escapes a prison sentence by faking his own death and assuming a new identity as he seeks revenge.,https://artworks.thetvdb.com/banners/posters/126121-3.jpg
996,Kaçak,"Gürkan Uygun, Mustafa Avkıran, Berk Hakman, Begüm Birgören, Özlem Yılmaz, Yağmur Tanrısevsin, İnanç Konukçu, Hasan Küçükçetin, Metin Coşkun, Selda Özer, Yağız Atakan Savaş, Burak Deniz, Cengiz Sezici, Haluk Bilginer, Tuğba Melis Türk",Turkey,2013,"Crime TV Shows, International TV Shows, TV Action & Adventure",A cop who killed a mobster's son and fled to a small town with a changed identity finds his quiet new life disrupted when he becomes a local hero.,na
997,Kurt Seyit & Sura,"Kıvanç Tatlıtuğ, Farah Zeynep Abdullah, Fahriye Evcen, Ushan Çakır, Birkan Sokullu",Turkey,2014,"International TV Shows, Romantic TV Shows, TV Dramas",A Turkish lieutenant and the daughter of Russian nobles fight for their love against forces of family and social expectation and historical events.,https://artworks.thetvdb.com/banners/posters/279507-6.jpg
998,Mahmut & Meryem,"Aras Bulut İynemli, Eva Dedova, Fahreddin Manafov, Melahat Abbasova, Polat Bilgin, Mehmet Çevik, Shamil Suleimanov, Şafak Başkaya, İlker Kızmaz, Kristina Krepela, Ufuk Şen","Turkey, Azerbaijan",2013,"International TV Shows, Romantic TV Shows, TV Dramas","In the 16th century, the heir to a Muslim empire embarks on a dangerous journey to find his true love, who was taken away by her Christian father.",https://artworks.thetvdb.com/banners/movies/91070/posters/91070.jpg
999,Part-Time Idol,"Hee-jeong Kim, Seung-un Hwang, Soo-hyun Lee, Hyun-bin Kwon, Young-deuk Kwon, Kim Min-kyo",,2017,"International TV Shows, Korean TV Shows, TV Comedies","After taking a break from the business, a music producer returns with a new project in mind: launching a co-ed pop idol group.",https://artworks.thetvdb.com/banners/posters/338478-1.jpg
1000,Planet Earth II,David Attenborough,United Kingdom,2016,"British TV Shows, Docuseries, Science & Nature TV","In this sequel to the Emmy-winning ""Planet Earth"" series, viewers are treated to rich and intimate views of the natural diversity of our planet.",https://artworks.thetvdb.com/banners/posters/285668-1.jpg
1001,Sammy & Co,,France,2014,"Kids' TV, TV Comedies","In an underwater village bordering a tropical island, two young turtles and their pals keep their home safe and enjoy adventures in the big, wild sea.",https://artworks.thetvdb.com/banners/series/346673/posters/62063485.jpg
1002,Hi Score Girl,"Kohei Amasaki, Sayumi Suzushiro, Yuuki Hirose, Kazuyuki Okitsu, Daiki Yamashita, Daria Midou, Satomi Arai, Shizuka Ito, Cho, Chinatsu Akasaki, Tomokazu Sugita, Yuichi Nakamura, Kana Ueda, Taketora, Hochu Otsuka, Hiroki Yasumoto",Japan,2018,"Anime Series, International TV Shows, Romantic TV Shows","A chronic gamer abysmally inept in academics and sports finally meets his match at his usual shady arcade – and it’s his rich classmate, Akira.",https://artworks.thetvdb.com/banners/posters/5c242a14e6dd2.jpg
1003,Stand Up and Away! with Brian Regan,Brian Regan,United States,2018,"Stand-Up Comedy & Talk Shows, TV Comedies",Brian Regan blends his trademark observational stand-up with short sketches and a bit of audience interaction in this hybrid comedy series.,https://artworks.thetvdb.com/banners/posters/5c78af12bcaa5.jpg
1004,Way Back into Love,"June Tsai, Ray Chang, Lung Shao-hua, Yi-Wen Yen, Ching-kuan Wang, Mai Sato",Taiwan,2011,"International TV Shows, Romantic TV Shows, TV Comedies","After years in the U.S., a Taiwanese immigrant returns to her hometown with a young daughter in tow to assist her father with his bed-and-breakfast.",https://artworks.thetvdb.com/banners/posters/164741-1.jpg
1005,Ninja Hattori,"Junko Hori, Masako Sugaya, Yuko Mita, Kaneta Kimotsuki, Kenichi Ogata, Eiko Yamada, Yuzuru Fujimoto, Yuri Nashiwa, Runa Akiyama, Issei Futamata",Japan,1981,"Anime Series, Kids' TV","Elementary school student Kenichi Mitsuba's household gains a surprising new member: Kanzo Hattori, a mischievous but helpful young ninja.",https://artworks.thetvdb.com/banners/posters/5c240d135b7a1.jpg
1006,Watership Down,"James McAvoy, Nicholas Hoult, John Boyega, Ben Kingsley, Tom Wilkinson, Gemma Arterton, Peter Capaldi, Olivia Colman, Mackenzie Crook, Anne-Marie Duff, Taron Egerton, James Faulkner, Freddie Fox, Lee Ingleby, Miles Jupp, Daniel Kaluuya, Rory Kinnear, Craig Parkinson, Rosamund Pike, Daniel Rigby, Jason Watkins","Ireland, United Kingdom, United States",2018,"British TV Shows, International TV Shows, TV Action & Adventure",A warren of rabbits battles many threats on their daring journey to find a new home in this adaptation of the classic novel by Richard Adams.,https://artworks.thetvdb.com/banners/posters/340065-2.jpg
1007,Myths & Monsters,Nicholas Day,United Kingdom,2017,"British TV Shows, Docuseries",This documentary series takes us to the mythic landscapes of Europe to explore some of most enduring legends produced by European culture.,https://artworks.thetvdb.com/banners/posters/5c826c9204336.jpg
1008,Demon's Path,"Wai Ai, Jim Chim Sui Man, Kwok-Pong Chan, Felix Lok, Sham Ka Ki, Elanne Kong, Kate Yeung, Ong Yi-hing, Sunny Lau",,2018,"Crime TV Shows, International TV Shows, TV Dramas","To catch three criminal masterminds, a group of cops teams up with a forensic pathologist who can see a murder victim's final moments before death.",https://artworks.thetvdb.com/banners/posters/345036-1.jpg
1009,Single Ladies Senior,"Summer Meng, Christina Mok, Alina Cheng, Bonnie Wang",,2018,"International TV Shows, Romantic TV Shows, TV Dramas",Four best friends and spirited career women navigate the treacherous world of romance – even as it stands in the way of work and friendship.,https://artworks.thetvdb.com/banners/posters/5b728c1d1d62e.jpg
1010,72 Dangerous Animals: Latin America,Bob Brisbane,"Australia, United States",2017,"Docuseries, International TV Shows, Science & Nature TV","Powerful cats, indestructible arachnids and flesh-melting pit vipers are just the beginning in this series about Latin America's deadliest creatures.",https://artworks.thetvdb.com/banners/posters/5c1db9b71f563.jpg
1011,7 Days Out,,United States,2018,Docuseries,"Witness the excitement and drama behind the scenes in the seven days leading up to major live events in the worlds of sports, fashion, space and food.",https://artworks.thetvdb.com/banners/series/345944/posters/62072319.jpg
1012,Diablero,"Christopher Von Uckermann, Horacio García Rojas, Gisselle Kuri, Fátima Molina, Dolores Heredia, Humberto Busto, Quetzalli Cortés, Alexa Martin, Flavio Medina, Dulce Neri, Mariana Botas",Mexico,2018,"International TV Shows, Spanish-Language TV Shows, TV Action & Adventure","When a young girl goes missing in a big city, a desperate priest joins a demon hunter and his motley crew on an otherworldly mission to find her.",https://artworks.thetvdb.com/banners/posters/333314-1.jpg
1013,Jojo's World,"Tia Lee, In Deok Hwang, Yen-j, Jason Hsu, Andy Wu, Sharon Hsu",Taiwan,2017,"International TV Shows, Romantic TV Shows, TV Comedies","Diagnosed with a condition that could make her infertile, a career woman must choose one of four bachelors to make a baby with before time runs out.",https://artworks.thetvdb.com/banners/posters/338651-1.jpg
1014,Lion Pride,"Yen Tsao, Amanda Chou, Kevin Liu, Peace Yang, Kenny Wen, Tzu-chiang Chao, Vince Kao, Lin Ching-Tai, Lin He Xuan, Michael Yang",Taiwan,2017,"International TV Shows, Romantic TV Shows, TV Comedies","After crossing paths at a crime scene, a renowned math teacher and an antiques appraiser embark on an unexpected journey of love and self-discovery.",https://artworks.thetvdb.com/banners/posters/310580-2.jpg
1015,Love @ Seventeen,"Lego Lee, Nikki Hsin-Ying Hsieh, Edison Wang, Amanda Chou",Taiwan,2016,"International TV Shows, Romantic TV Shows, TV Dramas","Radically changed by a misunderstanding 13 years ago, a biotech expert runs into an old flame and suffers an illness that takes her back to the past.",na
1016,Perfume,"Friederike Becht, August Diehl, Wotan Wilke Möhring, Natalia Belitski, Ken Duken, Trystan Pütter, Christian Friedel, Juergen Maurer, Marc Hosemann, Susanne Wuest",Germany,2018,"Crime TV Shows, International TV Shows, TV Dramas","When a singer is found murdered, with her scent glands excised from her body, detectives probe a group of friends who attended boarding school with her.",na
